commit	val_bpb	memory_gb	status	description
a4123c6	0.583630	0.4	keep	baseline: depth=4 dim=256 seq=512 batch=4
a4123c6	0.569662	1.2	keep	increase compatibility microbatch 4->16
a4123c6	0.585515	1.6	discard	disable activation checkpointing
a4123c6	0.578222	1.2	discard	verification rerun of microbatch 16
